{"v":"ACDC10JSON000332_","d":"EPfjmkrsQVLmI3Z7vI1crMfEmAovAtX6x3Q_D3a_-GPD","u":"0AAAAQIDBAUGBwgJCgsMDQ4P","i":"DIqI4910CfGV_VLbLTy6XXLKZwm_HZQSG_N0iAG0D29c","ri":"EL5BLAjSMOPHAq0_-U7i0X3hzhMgXOTobsPoXh1sXX7j","s":"ECg_trM84AAnW4ZILy8XhIrXCVSQYqpQ-hktJdk_x0g8","a":{"d":"EI1sFAANV-BU6YBcM0kvn0kKniHBW3BX-CQZ_--zcVUR","extId":"eip155:1:0x7e5f4552091a69125d5dfcb7b8c2659029395bdf","proof":{"d":"EPTwWHZ5p4AlLo4U4IM8zsmtObavT59EsnCO8a4RP7X8","alg":"EIP-712/ES256K","tag":"vlei-external-association/v1","sig":"0x67ba7282954e74c5742fc3bc0c6eedc8750deb2089f8193f163fe7b1851a55a91d14452d0ccfd5a1d85f6d893e9171bf48127e4989c755dd4095481c63d737b21b"}},"e":{"d":"EPy-9ok3jovjCkjvCFtWU0Ew_5Igdp663_wIry7CGq_y","le":{"n":"EDtvFDCx-Kjtac85bs5PenfQlm41Y5BlWlpooRhF-RGn","s":"ENPXp1vQzRF6JwIuS-mp2U8Uf1MoADoP_GqQ62VsDZWY","o":"I2I"}}}